Variable / Field Name,Form Name,Form Display Name,Section Header (defunct),Allow,multipleChoice,Field Type,Field Label,"Choices, Calculations, OR Slider Labels",Field Note,Text Validation Type OR Show Slider Number,Text Validation Min,Text Validation Max,Identifier?,Branching Logic (Show field only if...),Required Field?,Custom Alignment,Question Number (surveys only),Matrix Group Name,Matrix Ranking?,Field Annotation,version
mania_title,maniahypomania,Mania/Hypomania,,,,markdown-message,## Mania/Hypomania,,,,,,,,,,,,,,
cman0,maniahypomania,Mania/Hypomania,Current/Most Recent Episode,,,markdown-message,"### Current/Most Recent Episode\r\n\r\nSome young people have times when they are energetic, or cheerful, very different from how they usually feel.  At these times, they may also feel more talkative, more active, sleep less and feel more restless.",,,,,,,,,,,,,,
dcman001,maniahypomania,Mania/Hypomania,,autoAdvance,,radio,"So you said that you had a time when you've felt (more active, excited, energetic): \r\n\r\n Do you feel this way now?","0, No | 1, Yes | 9, Unknown",,,,,,,,RH,,,,,
dcman002,maniahypomania,Mania/Hypomania,,,,text,"How old were you the last time you felt this way? \r\n\r\n _Code 998 if ""always"", 999 if ""unknown""._",,AGE,autocomplete,,,,[dcman001] = '0',,RH,,,,,
cman1,maniahypomania,Mania/Hypomania,,,,text,"How long did you feel this way? \r\n\r\n _(N days, N weeks, N months)_",,,,,,,[dcman001] = '0',,,,,,,
cman2,maniahypomania,Mania/Hypomania,,,,text,How old were you when this ended?,,,,,,,[dcman001] = '0',,,,,,,
cman3,maniahypomania,Mania/Hypomania,,,,text,"How long have you felt this way?  \r\n\r\n _(N days, N weeks, N months)_",,,,,,,[dcman001] = '1',,,,,,,
dcman012,maniahypomania,Mania/Hypomania,,autoAdvance,,radio,Was there a time that was more intense or lasted longer than this time?,"0, No | 1, Yes | 9, Unknown",,,,,,,,RH,,,,,
dcman013,maniahypomania,Mania/Hypomania,,,,text,"How old were you when you felt this way? \r\n\r\n _Code 998 if ""always"", 999 if ""unknown""._",,AGE,autocomplete,,,,[dcman012] = '1',,RH,,,,,
cman4,maniahypomania,Mania/Hypomania,,,,text,"How long did you feel this way? \r\n\r\n _(N days, N weeks, N months)_",,,,,,,[dcman012] = '1',,,,,,,
cman5,maniahypomania,Mania/Hypomania,,,,text,How old were you when this ended?,,,,,,,[dcman012] = '1',,,,,,,
cman6,maniahypomania,Mania/Hypomania,,,,markdown-message,_INTERVIEWER: Code the most intense episode._ \r\n\r\n Now I would like to talk to you about that time.,,,,,,,,,,,,,,
dcman020,maniahypomania,Mania/Hypomania,Mood,autoAdvance,,radio,"### Mood\r\n\r\nDuring this time, did you: \r\n\r\n Feel really, really happy or excited much more than usual?","0, No | 1, Yes | 9, Unknown",,,,,,,,,,dcman020,,,
dcman022,maniahypomania,Mania/Hypomania,,autoAdvance,,radio,"Feel grouchy, cranky, or irritable? When the smallest things would make you really mad?","0, No | 1, Yes | 9, Unknown",,,,,,,,,,dcman020,,,
dcman023,maniahypomania,Mania/Hypomania,,autoAdvance,,radio,Get easily mad or annoyed?,"0, No | 1, Yes | 9, Unknown",,,,,,,,,,dcman020,,,
dcman024,maniahypomania,Mania/Hypomania,Increased Activity/Restlessness,autoAdvance,,radio,### Increased Activity/Restlessness\r\n\r\nDuring this time: \r\n\r\n Did you get through your school work much more easily or faster than usual?,"0, No | 1, Yes | 9, Unknown",,,,,,,,,,dcman024,,,
dcman025,maniahypomania,Mania/Hypomania,,autoAdvance,,radio,Did you spend much more time with your friends or were you going out more than usual?,"0, No | 1, Yes | 9, Unknown",,,,,,,,,,dcman024,,,
dcman026,maniahypomania,Mania/Hypomania,,autoAdvance,,radio,Were you more involved with your family?,"0, No | 1, Yes | 9, Unknown",,,,,,,,,,dcman024,,,
dcman027,maniahypomania,Mania/Hypomania,,"autoAdvance, dontKnow",,radio,"_INTERVIEWER: Use discretion on whether to ask child this question._ \r\n\r\n Were you interested in sex more than usual, or more sexually active?","0, No | 1, Yes | 9, Unknown",,,,,,,,,,dcman027,,,
dcman028,maniahypomania,Mania/Hypomania,,autoAdvance,,radio,Did you do more physical activities?,"0, No | 1, Yes | 9, Unknown",,,,,,,,,,dcman027,,,
dcman029,maniahypomania,Mania/Hypomania,,autoAdvance,,radio,Were you really restless or did you have trouble sitting still?,"0, No | 1, Yes | 9, Unknown",,,,,,,,,,dcman027,,,
dcman030,maniahypomania,Mania/Hypomania,Sleep,,,text,### Sleep\r\n\r\nHow many hours of sleep do you usually get per night?,,HOURS,number,,,,,,RH,,,,,
dcman031,maniahypomania,Mania/Hypomania,,,,text,"During this time, how many hours, on average, do you sleep per night?",,HOURS,number,,,,,,RH,,,,,
cman13,maniahypomania,Mania/Hypomania,,autoAdvance,,radio,Was this fewer hours than normal?,"0, No | 1, Yes | 9, Unknown",,,,,,,,,,,,,
dcman032,maniahypomania,Mania/Hypomania,,autoAdvance,,radio,Did you feel rested even though you slept less than usual?,"0, No | 1, Yes | 9, Unknown",,,,,,[cman13] = '1',,RH,,,,,
dcman033,maniahypomania,Mania/Hypomania,,autoAdvance,,radio,Were you able to do more activities than usual with the same amount of sleep?,"0, No | 1, Yes | 9, Unknown",,,,,,[cman13] = '0',,RH,,,,,
dcman034,maniahypomania,Mania/Hypomania,Talkative/Pressured Speech,autoAdvance,,radio,### Talkative/Pressured Speech\r\n\r\nDid you talk more than usual?,"0, No | 1, Yes | 9, Unknown",,,,,,,,,,dcman034,,,
dcman035,maniahypomania,Mania/Hypomania,,autoAdvance,,radio,Did you feel you just couldn't stop talking?,"0, No | 1, Yes | 9, Unknown",,,,,,,,,,dcman034,,,
dcman036,maniahypomania,Mania/Hypomania,,autoAdvance,,radio,Did you talk faster than usual?,"0, No | 1, Yes | 9, Unknown",,,,,,,,,,dcman034,,,
dcman037,maniahypomania,Mania/Hypomania,,autoAdvance,,radio,Did people have trouble understanding you or try to get you to talk slower?,"0, No | 1, Yes | 9, Unknown",,,,,,,,,,dcman034,,,
dcman038,maniahypomania,Mania/Hypomania,Racing Thoughts/Flight of Ideas,autoAdvance,,radio,### Racing Thoughts/Flight of Ideas\r\n\r\nDid your thoughts go faster than usual?,"0, No | 1, Yes | 9, Unknown",,,,,,,,,,dcman038,,,
dcman039,maniahypomania,Mania/Hypomania,,autoAdvance,,radio,So fast it was hard to keep up with them?,"0, No | 1, Yes | 9, Unknown",,,,,,[dcman038] = '1',,,,dcman038,,,
dcman040,maniahypomania,Mania/Hypomania,,autoAdvance,,radio,Did they race through your head?,"0, No | 1, Yes | 9, Unknown",,,,,,[dcman038] = '1',,,,dcman038,,,
dcman041,maniahypomania,Mania/Hypomania,,autoAdvance,,radio,Did they make sense to you?,"0, No | 1, Yes | 9, Unknown",,,,,,[dcman038] = '1',,,,dcman038,,,
dcman042,maniahypomania,Mania/Hypomania,,autoAdvance,,radio,Did they make sense to other people?,"0, No | 1, Yes | 9, Unknown",,,,,,[dcman038] = '1',,,,dcman038,,,
dcman043,maniahypomania,Mania/Hypomania,,autoAdvance,,radio,Did other people have trouble following what you were saying?,"0, No | 1, Yes | 9, Unknown",,,,,,,,,,dcman038,,,
dcman044,maniahypomania,Mania/Hypomania,,autoAdvance,,radio,Did you have too many thoughts jumping through your mind?,"0, No | 1, Yes | 9, Unknown",,,,,,,,,,dcman038,,,
dcman045,maniahypomania,Mania/Hypomania,Distractibility,autoAdvance,,radio,"### Distractibility\r\n\r\nDid you have problems concentrating, or get distracted very easily?","0, No | 1, Yes | 9, Unknown",,,,,,,,,,dcman045,,,
dcman046,maniahypomania,Mania/Hypomania,,autoAdvance,,radio,Did you keep noticing things that you would've normally ignored?,"0, No | 1, Yes | 9, Unknown",,,,,,,,,,dcman045,,,
dcman047,maniahypomania,Mania/Hypomania,,autoAdvance,,radio,Did you have trouble keeping your mind on things?,"0, No | 1, Yes | 9, Unknown",,,,,,,,,,dcman045,,,
dcman048,maniahypomania,Mania/Hypomania,,autoAdvance,,radio,Did it interfere with schoolwork or reading?,"0, No | 1, Yes | 9, Unknown",,,,,,,,,,dcman045,,,
dcman049,maniahypomania,Mania/Hypomania,,autoAdvance,,radio,Was this so much of a problem that other people noticed?,"0, No | 1, Yes | 9, Unknown",,,,,,,,,,dcman045,,,
dman050,maniahypomania,Mania/Hypomania,Self-Esteem/Grandiosity,autoAdvance,,radio,### Self-Esteem/Grandiosity\r\n\r\nDid you feel more confident in yourself than usual?,"0, No | 1, Yes | 9, Unknown",,,,,,,,,,dcman050,,,
dman051,maniahypomania,Mania/Hypomania,,autoAdvance,,radio,Did you feel like you could do anything?,"0, No | 1, Yes | 9, Unknown",,,,,,,,,,dcman050,,,
dman052,maniahypomania,Mania/Hypomania,,autoAdvance,,radio,Did you feel you were a very important person?,"0, No | 1, Yes | 9, Unknown",,,,,,,,,,dcman050,,,
dman053,maniahypomania,Mania/Hypomania,,autoAdvance,,radio,"Did you feel like you had abilities that made you more special, smarter, or better than other people?","0, No | 1, Yes | 9, Unknown",,,,,,,,,,dcman050,,,
dcman054,maniahypomania,Mania/Hypomania,Risk of Painful Consequences,autoAdvance,,radio,"### Risk of Painful Consequences\r\n\r\nDid you do things that you usually wouldn't do, or did you do things that you later wished you hadn't done? For example, did you: \r\n\r\n Spend or borrow a lot of money?","0, No | 1, Yes | 9, Unknown",,,,,,,,,,dcman054,,,
dcman055,maniahypomania,Mania/Hypomania,,autoAdvance,,radio,Do things that could get you into trouble?,"0, No | 1, Yes | 9, Unknown",,,,,,,,,,dcman054,,,
dcman056,maniahypomania,Mania/Hypomania,,,,notes,Describe,,,,,,,[dcman055] = '1',,LH,,,,,
dcman057,maniahypomania,Mania/Hypomania,,autoAdvance,,radio,Do things from which you might get hurt?,"0, No | 1, Yes | 9, Unknown",,,,,,,,RH,,,,,
dcman058,maniahypomania,Mania/Hypomania,,,,notes,Describe,,,,,,,[dcman057] = '1',,LH,,,,,
dcman059,maniahypomania,Mania/Hypomania,,autoAdvance,,radio,Make a lot of telephone calls or call people at strange hours?,"0, No | 1, Yes | 9, Unknown",,,,,,,,,,dcman059,,,
dcman060,maniahypomania,Mania/Hypomania,,autoAdvance,,radio,Anything else?,"0, No | 1, Yes | 9, Unknown",,,,,,,,,,dcman059,,,
dcman061,maniahypomania,Mania/Hypomania,,,,notes,Describe,,,,,,,[dcman060] = '1',,LH,,,,,
dcman062,maniahypomania,Mania/Hypomania,Symptom Frequency,autoAdvance,,radio,### Symptom Frequency\r\n\r\nYou just told me that when you felt (more active) that you also had (list symptoms).  How often did you have these things?,"1, Most days | 2, About half of the days | 3, Less than half the days | 9, Don't know",,,,,,,,LH,,,,,
dcman063,maniahypomania,Mania/Hypomania,,autoAdvance,,radio,"On the days you had these things, how much of the day did you have them?","1, All of the day | 2, Most of the day | 3, Half of the day | 4, Only a little part of the day",,,,,,,,LH,,,,,
cman22,maniahypomania,Mania/Hypomania,Depressive Symptoms,,,markdown-message,"### Depressive Symptoms\r\n\r\nDuring this period, did you also feel/have? (As I list these other symptoms, please recall if you have ever had any of them at the same time.) \r\n\r\n _INTERVIEWER: Refer to Participant Card 7 (Course Pattern) _",,,,,,,,,,,,,,
dcman064,maniahypomania,Mania/Hypomania,,autoAdvance,,radio,"During this period, did you also feel/have: \r\n\r\n Depressed/Sad mood?","0, No | 1, Yes | 9, Unknown",,,,,,,,RH,,,,,
dcman065,maniahypomania,Mania/Hypomania,,,,text,How long did this last? (N of Days),,DAYS,number,,,,[dcman064] = '1',,RH,,,,,
dcman066,maniahypomania,Mania/Hypomania,,autoAdvance,,radio,Loss of interest or pleasure?,"0, No | 1, Yes | 9, Unknown",,,,,,,,RH,,,,,
dcman067,maniahypomania,Mania/Hypomania,,,,text,How long did this last? (N of Days),,DAYS,number,,,,[dcman066] = '1',,RH,,,,,
dcman068,maniahypomania,Mania/Hypomania,,autoAdvance,,radio,Changes in sleep?,"0, No | 1, Yes | 9, Unknown",,,,,,,,RH,,,,,
dcman069,maniahypomania,Mania/Hypomania,,autoAdvance,,radio,Did you sleep more or less?,"1, Decreased | 2, Increased",,,,,,[dcman064] = '1' and [dcman066] = '1' and [dcman068] = '1',,RH,,,,,
dcman070,maniahypomania,Mania/Hypomania,,,,text,How long did this last? (N of Days),,DAYS,number,,,,[dcman064] = '1' and [dcman066] = '1' and [dcman068] = '1',,RH,,,,,
dcman071,maniahypomania,Mania/Hypomania,,autoAdvance,,radio,Changes in eating?,"0, No | 1, Yes | 9, Unknown",,,,,,,,RH,,,,,
dcman072,maniahypomania,Mania/Hypomania,,autoAdvance,,radio,Did you eat more or less?,"1, Decreased | 2, Increased",,,,,,[dcman064] = '1' and [dcman066] = '1' and [dcman071] = '1',,RH,,,,,
dcman073,maniahypomania,Mania/Hypomania,,,,text,How long did this last? (N of Days),,DAYS,number,,,,[dcman064] = '1' and [dcman066] = '1' and [dcman071] = '1',,RH,,,,,
dcman074,maniahypomania,Mania/Hypomania,,autoAdvance,,radio,Changes in motor activity or movement?,"0, No | 1, Yes | 9, Unknown",,,,,,,,RH,,,,,
dcman075,maniahypomania,Mania/Hypomania,,autoAdvance,,radio,Did you move more or less?,"1, Decreased | 2, Increased",,,,,,[dcman064] = '1' and [dcman066] = '1' and [dcman074] = '1',,RH,,,,,
dcman076,maniahypomania,Mania/Hypomania,,,,text,How long did this last? (N of Days),,DAYS,number,,,,[dcman064] = '1' and [dcman066] = '1' and [dcman074] = '1',,RH,,,,,
dcman077,maniahypomania,Mania/Hypomania,,autoAdvance,,radio,Changes in energy?,"0, No | 1, Yes | 9, Unknown",,,,,,,,RH,,,,,
dcman078,maniahypomania,Mania/Hypomania,,autoAdvance,,radio,Did you have more or less energy?,"1, Decreased | 2, Increased",,,,,,[dcman064] = '1' and [dcman066] = '1' and [dcman077] = '1',,RH,,,,,
dcman079,maniahypomania,Mania/Hypomania,,,,text,How long did this last? (N of Days),,DAYS,number,,,,[dcman064] = '1' and [dcman066] = '1' and [dcman077] = '1',,RH,,,,,
dcman080,maniahypomania,Mania/Hypomania,,autoAdvance,,radio,Changes in concentration?,"0, No | 1, Yes | 9, Unknown",,,,,,,,RH,,,,,
dcman081,maniahypomania,Mania/Hypomania,,autoAdvance,,radio,Did you concentrate more or less?,"1, Decreased | 2, Increased",,,,,,[dcman064] = '1' and [dcman066] = '1' and [dcman080] = '1',,RH,,,,,
dcman082,maniahypomania,Mania/Hypomania,,,,text,How long did this last? (N of Days),,DAYS,number,,,,[dcman064] = '1' and [dcman066] = '1' and [dcman080] = '1',,RH,,,,,
dcman083,maniahypomania,Mania/Hypomania,,autoAdvance,,radio,Did you also feel guilt?,"0, No | 1, Yes | 9, Unknown",,,,,,,,RH,,,,,
dcman084,maniahypomania,Mania/Hypomania,,,,text,How long did this last? (N of Days),,DAYS,number,,,,[dcman083] = '1',,RH,,,,,
dcman085,maniahypomania,Mania/Hypomania,Delusions:,autoAdvance,,radio,### Delusions:\r\n\r\nDid you think that someone was trying to harm you?,"0, No | 1, Yes | 9, Unknown",,,,,,,,,,dcman085,,,
dcman086,maniahypomania,Mania/Hypomania,,autoAdvance,,radio,Did you think that you had powers or abilities that others did not have?,"0, No | 1, Yes | 9, Unknown",,,,,,,,,,dcman085,,,
dcman087,maniahypomania,Mania/Hypomania,,autoAdvance,,radio,Did you think that you had a special mission?,"0, No | 1, Yes | 9, Unknown",,,,,,,,,,dcman085,,,
dcman088,maniahypomania,Mania/Hypomania,,autoAdvance,,radio,Did you believe things that other people didn't think were true?,"0, No | 1, Yes | 9, Unknown",,,,,,,,,,dcman085,,,
dcman089,maniahypomania,Mania/Hypomania,,autoAdvance,,radio,"_INTERVIEWER: Based on clinical judgment, were these 
**real delusions**? If they were, record examples in the next screens._","0, No | 1, Yes | 9, Unknown",,,,,,,,RH,,,,,
dcman090a,maniahypomania,Mania/Hypomania,,dontKnow,,text,Delusion Example 1:,,EXAMPLE,,,,,[dcman089] = '1',,,,,,,
dcman090b,maniahypomania,Mania/Hypomania,,dontKnow,,text,Delusion Example 2:,,EXAMPLE,,,,,[dcman089] = '1',,,,,,,
dcman090c,maniahypomania,Mania/Hypomania,,dontKnow,,text,Delusion Example 3:,,EXAMPLE,,,,,[dcman089] = '1',,,,,,,
dcman090d,maniahypomania,Mania/Hypomania,,dontKnow,,text,Delusion Example 4:,,EXAMPLE,,,,,[dcman089] = '1',,,,,,,
dcman091,maniahypomania,Mania/Hypomania,,autoAdvance,,radio,"Did you start thinking these things before, after, or at the same time that you started feeling (too active/happy/excited/grouchy /energetic)?","1, Before | 2, During | 3, After | 9, Don't know",,,,,,[dcman089] = '1',,LH,,,,,
dcman092,maniahypomania,Mania/Hypomania,,autoAdvance,,radio,"Did you think this was true, even when you stopped feeling (too happy/excited/grouchy/energetic)?","0, No | 1, Yes | 9, Unknown",,,,,,[dcman089] = '1',,RH,,,,,
cman37,maniahypomania,Mania/Hypomania,,,,text,"For how long did you think this was true? (N of Days, N of Weeks)",,,,,,,[dcman089] = '1',,,,,,,
dcman095,maniahypomania,Mania/Hypomania,Hallucinations,autoAdvance,,radio,"### Hallucinations\r\n\r\nDuring this time, did you see or hear things that other people could not see or hear? \r\n\r\n  _PROBE: Like voices talking to you or noises, or visions?_","0, No | 1, Yes | 9, Unknown",,,,,,,,,,dcman095,,,
dcman096,maniahypomania,Mania/Hypomania,,autoAdvance,,radio,"Did you experience funny or unusual smells, tastes, or sensations in your body?","0, No | 1, Yes | 9, Unknown",,,,,,,,,,dcman095,,,
dcman097,maniahypomania,Mania/Hypomania,,autoAdvance,,radio,"_INTERVIEWER: Based on clinical judgment, were these **real hallucinations**?  If they were, record examples in the next screens._","0, No | 1, Yes | 9, Unknown",,,,,,,,RH,,,,,
dcman098a,maniahypomania,Mania/Hypomania,,dontKnow,,text,Hallucination Example 1:,,EXAMPLE,,,,,[dcman097] = '1',,,,,,,
dcman098b,maniahypomania,Mania/Hypomania,,dontKnow,,text,Hallucination Example 2:,,EXAMPLE,,,,,[dcman097] = '1',,,,,,,
dcman098c,maniahypomania,Mania/Hypomania,,dontKnow,,text,Hallucination Example 3:,,EXAMPLE,,,,,[dcman097] = '1',,,,,,,
dcman098d,maniahypomania,Mania/Hypomania,,dontKnow,,text,Hallucination Example 4:,,EXAMPLE,,,,,[dcman097] = '1',,,,,,,
dcman099,maniahypomania,Mania/Hypomania,,autoAdvance,,radio,"Did these _(list endorsed hallucinations)_ start before, after or at the same time that you started feeling (too happy/excited/grouchy/energetic)?","1, Before | 2, During | 3, After | 9, Don't know",,,,,,[dcman097] = '1',,LH,,,,,
dcman100,maniahypomania,Mania/Hypomania,,autoAdvance,,radio,Did they stay even when you stopped feeling (too happy/excited/grouchy/energetic)?,"0, No | 1, Yes | 9, Unknown",,,,,,[dcman097] = '1',,RH,,,,,
cman40,maniahypomania,Mania/Hypomania,,,,markdown-message,"For how long did you have them?  (N Days, N weeks)",,,,,,,[dcman097] = '1',,,,,,,
dcman103,maniahypomania,Mania/Hypomania,Mood Congruency,autoAdvance,,radio,"### Mood Congruency\r\n\r\n_INTERVIEWER: If respondent had any psychotic symptoms, was the content **consistent** with manic themes such as inflated worth, power, knowledge, identity or special relationship with a deity or famous person?_","0, No | 1, Yes | 9, Unknown | 7, N/A",,,,,,,,RH,,,,,
cman42,maniahypomania,Mania/Hypomania,Associated Conditions (Episode),,,markdown-message,### Associated Conditions (Episode)\r\n\r\n_INTERVIEWER: Associated condition questions apply **ONLY** to episode being coded._,,,,,,,,,,,,,,
dcman104,maniahypomania,Mania/Hypomania,,autoAdvance,,radio,When you were feeling (too happy/excited/grouchy/energetic): \r\n\r\n Did you have a serious physical problem or illness? \r\n\r\n _Probe: Did the physical problem or illness start before you started feeling (too happy/excited/grouchy/energetic) or after?_,"0, No | 1, Yes | 9, Unknown",,,,,,,,RH,,,,,
dcman105,maniahypomania,Mania/Hypomania,,,,notes,Specify (Physical problem or illness):,,,,,,,[dcman104] = '1',,LH,,,,,
dcman106,maniahypomania,Mania/Hypomania,,autoAdvance,,radio,"
Were you taking any medicines that your doctor told you to take? Did you take any over the counter medications? \r\n\r\n _PROBE: Did you start to feel (too happy/excited/grouchy/energetic) before taking the medicine or after? _","0, No | 1, Yes | 9, Unknown",,,,,,,,RH,,,,,
dcman107,maniahypomania,Mania/Hypomania,,,,text,Specify (Medication 1):,,MEDICATION,,,,,[dcman106] = '1',,,,,,,
dcman108,maniahypomania,Mania/Hypomania,,,,text,Specify (Medication 2):,,MEDICATION,,,,,[dcman106] = '1',,,,,,,
dcman109,maniahypomania,Mania/Hypomania,,,,text,Specify (Medication 3):,,MEDICATION,,,,,[dcman106] = '1',,,,,,,
dcman110,maniahypomania,Mania/Hypomania,Alcohol and Drugs,,1,checkbox,### Alcohol and Drugs\r\n\r\nWere you using alcohol often or drugs or both during this time?  \r\n\r\n _PROBE: Did you start feeling this way before using alcohol/drugs or after or did you increase the quantity after you had these feelings?_,"0, Neither | 1, Alcohol | 2, Drugs | 9, Don't know",,,,,,,,RH,,,,,
dcman111,maniahypomania,Mania/Hypomania,,dontKnow,,notes,Specify (Alcohol and/or drug and quantity 1),,,,,,,[dcman110].includes(1) or [dcman100].includes(2),,LH,,,,,
dcman112,maniahypomania,Mania/Hypomania,,dontKnow,,notes,Specify (Alcohol and/or drug and quantity 2),,,,,,,[dcman110].includes(1) or [dcman100].includes(2),,LH,,,,,
dcman113,maniahypomania,Mania/Hypomania,,dontKnow,,notes,Specify (Alcohol and/or drug and quantity 3),,,,,,,[dcman110].includes(1) or [dcman100].includes(2),,LH,,,,,
cman43b,maniahypomania,Mania/Hypomania,Distress/Impairment (Episode),,,markdown-message,"### Distress/Impairment (Episode)\r\n\r\nI want to know how your feeling (too happy/excited/grouchy/energetic) and other symptoms caused problems for you. Please look at the scale: Participant Card 8, Distress/Impaiment \r\n\r\n _INTERVIEWER: Remind child how to use scale, if necessary, and assess areas most pertinent to the disorder; e.g. family, school, peers._",,,,,,,,,,,,,,
dcman114,maniahypomania,Mania/Hypomania,Distress,autoAdvance,,radio,### Distress\r\n\r\nHow much did your feeling (too happy/excited/grouchy/energetic) and (list other symptoms) upset or bother you?,"0, 0 | 1, 1 | 2, 2 | 3, 3 | 4, 4 | 5, 5 | 6, 6 | 7, 7 | 8, 8 | 9, 9 | 10, 10 | 998, Unknown",CODE RESPONSE,autocomplete,0,10,,,,,,,,,
dcman115,maniahypomania,Mania/Hypomania,Impairment,autoAdvance,,radio,"### Impairment\r\n\r\nHow much did the feeling (to happy/excited/grouchy/energetic) you told me about cause problems for you at home, at school, or with your family or friends?","0, 0 | 1, 1 | 2, 2 | 3, 3 | 4, 4 | 5, 5 | 6, 6 | 7, 7 | 8, 8 | 9, 9 | 10, 10 | 998, Unknown",CODE RESPONSE,autocomplete,0,10,,,,,,,,,
dcman116,maniahypomania,Mania/Hypomania,,autoAdvance,,radio,Did you stay home from school because of the way you were feeling?,"0, No | 1, Yes | 9, Unknown",,,,,,,,RH,,,,,
dcman117,maniahypomania,Mania/Hypomania,,,,text,How many days of school did you miss? (episode),,DAYS,number,,,,[dcman116] = '1',,,,,,,
dcman118,maniahypomania,Mania/Hypomania,Help-Seeking Treatment (Lifetime),autoAdvance,,radio,"### Help-Seeking Treatment (Lifetime)\r\n\r\nDid anyone, like a teacher or family member, suggest that you get help for (list behaviors/feelings)?","0, No | 1, Yes | 9, Unknown",,,,,,,,,,dcman118,,,
dcman119,maniahypomania,Mania/Hypomania,,autoAdvance,,radio,"Did you ever go to see a doctor, nurse, psychologist, social worker, school counselor, minister/priest or other professional to get help for (list behaviors/feelings)?","0, No | 1, Yes | 9, Unknown",,,,,,,,,,dcman118,,,
cman49,maniahypomania,Mania/Hypomania,,,,markdown-message,"What kind of person/people did you get help from? \r\n\r\n _INTERVIEWER: Refer to Participant Card 13 (Professional/Treatment), record and code responses on the following screens._",,,,,,,[dcman119] = '1',,,,,,,
dcman120,maniahypomania,Mania/Hypomania,,dontKnow,,text,Specify (Professional/Treatment 1):,,PROFESSIONAL/TREATMENT,,,,,[dcman119] = '1',,,,,,,
dcman121,maniahypomania,Mania/Hypomania,,dontKnow,,text,Code (Professional/Treatment 1):,,CODE RESPONSE,number,,,,[dcman119] = '1',,,,,,,
dcman122,maniahypomania,Mania/Hypomania,,dontKnow,,text,Specify (Professional/Treatment 2):,,PROFESSIONAL/TREATMENT,,,,,[dcman119] = '1',,,,,,,
dcman123,maniahypomania,Mania/Hypomania,,dontKnow,,text,Code (Professional/Treatment 2):,,CODE RESPONSE,number,,,,[dcman119] = '1',,,,,,,
dcman124,maniahypomania,Mania/Hypomania,,dontKnow,,text,Specify (Professional/Treatment 3):,,PROFESSIONAL/TREATMENT,,,,,[dcman119] = '1',,,,,,,
dcman125,maniahypomania,Mania/Hypomania,,dontKnow,,text,Code (Professional/Treatment 3):,,CODE RESPONSE,number,,,,[dcman119] = '1',,,,,,,
dcman127,maniahypomania,Mania/Hypomania,,dontKnow,,text,"_INTERVIEWER: If you listed multiple people, ask this question. If not, **Skip**:_ \r\n\r\n Who did you get help from the first time? \r\n\r\n Specify (Professional/Treatment):",,PROFESSIONAL/TREATMENT,,,,,[dcman119] = '1',,,,,,,
dcman128,maniahypomania,Mania/Hypomania,,dontKnow,,text,Code (Professional/Treatment):,,CODE RESPONSE,number,,,,[dcman119] = '1',,,,,,,
dcman129,maniahypomania,Mania/Hypomania,,,,text,"How old were you the first time you got help? \r\n\r\n _Code 998 if ""always"", 999 if ""unknown""._",,AGE,autocomplete,,,,[dcman119] = '1',,,,,,,
dcman130,maniahypomania,Mania/Hypomania,,autoAdvance,,radio,Are you getting help now?,"0, No | 1, Yes | 9, Unknown",,,,,,[dcman119] = '1',,RH,,,,,
dcman131,maniahypomania,Mania/Hypomania,,,,text,"If no, how old were you the last time you got help? \r\n\r\n _Code 998 if ""always"", 999 if ""unknown""._",,AGE,autocomplete,,,,[dcman130] = '0',,,,,,,
dcman132,maniahypomania,Mania/Hypomania,,,,notes,What did the professional say that you had (diagnoses given)? List:,,,,,,,[dcman119] = '1',,LH,,,,,
cman50,maniahypomania,Mania/Hypomania,,,1,checkbox,What kind of treatment(s) have you gotten? _(Check all that apply)_,"1, Out-patient (Going to see someone in an office) | 2, In-patient (Staying in a hospital) | 3, Other",,,,,,[dcman119] = '1',,,,,,,
dcman136,maniahypomania,Mania/Hypomania,,,,notes,Specify (Other treatment):,,,,,,,[cman50].includes(3),,LH,,,,,
dcman137,maniahypomania,Mania/Hypomania,,autoAdvance,,radio,"Were you on medications? \r\n\r\n _INTERVIEWER: Refer to Participant Card 9 (Medications), record and code responses in the following screens._","0, No | 1, Yes | 9, Unknown",,,,,,[dcman119] = '1',,RH,,,,,
dcman138,maniahypomania,Mania/Hypomania,,dontKnow,,text,Specify (Medication 1):,,MEDICATION,,,,,[dcman137] = '1',,RH,,,,,
dcman139,maniahypomania,Mania/Hypomania,,dontKnow,,text,Code (Medication 1):,,CODE RESPONSE,number,,,,[dcman137] = '1',,,,,,,
dcman140,maniahypomania,Mania/Hypomania,,dontKnow,,text,Specify (Medication 2):,,MEDICATION,,,,,[dcman137] = '1',,RH,,,,,
